제목,링크
웹툰 작가들이 써본 Claude AI 후기 / 마감 지옥에서 살아남는 법...!,https://blog.naver.com/entaca/224236034106
AI 이미지 툴 선택 전 꼭 보세요｜초보자에게 안 맞는 유형 4가지,https://blog.naver.com/ai_today/224196764246
"TIGER미국필라델피아반도체나스닥 vs AI반도체나스닥, 차이점 완벽 정리",https://blog.naver.com/damoment/224208695413
상황별로 골라 쓰는 구글 AI 3인방: 제미나이 vs 노트북LM vs AI 스튜디오,https://blog.naver.com/ramses8/224249566039
"“10년 뒤 절반이 사라진다?” AI 시대, 위험한 직업 5가지 vs 살아남을 직업 5가지",https://blog.naver.com/gadoappa/224186419050
"음악 생성 수노 ai (Suno AI), 글만 쓰면 노래가 만들어진다고요?",https://blog.naver.com/zomama/224187604667
몬스터 AI 역량검사 후기｜면접·문항 수·질문 유형·응시 소요시간 정리,https://blog.naver.com/lexington_ave/224163082763
하정우 AI 수석 '부산 북구갑 출마설! 한동훈과 맞대결?' 프로필 고향 학력 나이,https://blog.naver.com/ibpms/224244022238
정부 AI 상담 서비스 총정리: 국세청 AI 국세상담·고용노동부 AI 노동법 상담·법무부 법률구조 플랫폼 활용법,https://blog.naver.com/jobinfo4u/224165260480
"삼성 비스포크 AI 냉장고 RM70F90R2ZD 실사용 리뷰, 전기요금·AI기능 솔직 후기",https://blog.naver.com/simdy0223/224158085001
